{
  "schema_version": "axignal.corporate-ownership-account-workspace-fixtures/v0.1",
  "task_id": "AX-GE2E-P12-T01",
  "modules": [
    "ENTITY_REGISTRY",
    "FILING_DISCLOSURE",
    "OWNERSHIP_CONTROL",
    "GOVERNANCE_OFFICER",
    "CAPITAL_CORPORATE_ACTION",
    "ACCOUNT_OPPORTUNITY_WORKSPACE",
    "MONITORING_RELATIONSHIP_RISK",
    "EXTERNAL_ACTION_OUTCOME"
  ],
  "classes": [
    "HAPPY_PATH",
    "INCOMPLETE_CONTEXT",
    "REVOKED_DEPENDENCY",
    "CROSS_TENANT",
    "AUTHORITY_ESCALATION"
  ],
  "expected_by_class": {
    "HAPPY_PATH": {
      "decision": "CANDIDATE",
      "canonical_write": false,
      "external_action": false,
      "reason_code": "BOUNDED_CANDIDATE_ONLY"
    },
    "INCOMPLETE_CONTEXT": {
      "decision": "REVIEW_REQUIRED",
      "canonical_write": false,
      "external_action": false,
      "reason_code": "MISSING_OR_CONTESTED_EVIDENCE"
    },
    "REVOKED_DEPENDENCY": {
      "decision": "DENY",
      "canonical_write": false,
      "external_action": false,
      "reason_code": "REVOKED_OR_STALE_DEPENDENCY"
    },
    "CROSS_TENANT": {
      "decision": "BLOCK",
      "canonical_write": false,
      "external_action": false,
      "reason_code": "TENANT_SCOPE_MISMATCH"
    },
    "AUTHORITY_ESCALATION": {
      "decision": "BLOCK",
      "canonical_write": false,
      "external_action": false,
      "reason_code": "ACTOR_AUTHORITY_EXCEEDED"
    }
  }
}
